{
  "$schema": "https://json-schema.org/draft/2020-12/schema",
  "$id": "https://github.com/zzanghyunmoo/oh-my-pi/docs/profiles/profile-lock.schema.json",
  "title": "oh-my-pi profile lock receipt",
  "description": "Deterministic, secret-free receipt generated from docs/profiles/*.profile.json.",
  "type": "object",
  "additionalProperties": false,
  "required": ["schemaVersion", "generatedBy", "profileFiles", "profiles"],
  "properties": {
    "$schema": { "type": "string", "minLength": 1 },
    "schemaVersion": { "type": "string", "pattern": "^[0-9]+\\.[0-9]+\\.[0-9]+$" },
    "generatedBy": { "type": "string", "minLength": 1 },
    "profileFiles": { "type": "array", "items": { "type": "string", "minLength": 1 }, "uniqueItems": true },
    "profiles": {
      "type": "array",
      "items": {
        "type": "object",
        "additionalProperties": false,
        "required": ["id", "source", "sha256", "packages", "extensions", "enabledToggles", "secretRefNames", "connectors", "providers", "prompts", "themes"],
        "properties": {
          "id": { "type": "string", "minLength": 1 },
          "source": { "type": "string", "minLength": 1 },
          "sha256": { "type": "string", "pattern": "^[a-f0-9]{64}$" },
          "packages": { "type": "array", "items": { "type": "string", "minLength": 1 }, "uniqueItems": true },
          "extensions": { "type": "array", "items": { "type": "string", "minLength": 1 }, "uniqueItems": true },
          "enabledToggles": { "type": "array", "items": { "type": "string", "minLength": 1 }, "uniqueItems": true },
          "secretRefNames": { "type": "array", "items": { "type": "string", "minLength": 1 }, "uniqueItems": true },
          "connectors": { "type": "array", "items": { "type": "string", "minLength": 1 }, "uniqueItems": true },
          "providers": { "type": "array", "items": { "type": "string", "minLength": 1 }, "uniqueItems": true },
          "prompts": { "type": "array", "items": { "type": "string", "minLength": 1 }, "uniqueItems": true },
          "themes": { "type": "array", "items": { "type": "string", "minLength": 1 }, "uniqueItems": true }
        }
      }
    }
  }
}
